"party","id","Name","Birth","Death","gender","Age.Group_Speech.","Period","Speech.Length","keyword","content.stemmed","content_remove_stem","ideology","vallankumous","kapina","Natioanalism","Socialism","Pacifst"
"Suomen Sosialidemokraattinen Puolue","http://ldf.fi/semparl/speeches/s1919_1_075_076","Hupli, Väinö",1886,1934,"Male","25-35","Civil_War","Very Long","kapina, vallankumous","kansa#kunta haavo lääkitseminen presidentti lincol ohjelmapuhea kauniisti lausua samantamaisesti lempeästi viisaasti palauttaa englanti boerikaina rauhallinen olo etelä-afrika ed von bor olla kapina suomi porvaristo noudattaa yhdysvaltain englanti esimerkki armahduskysymys maa e sisäpoliittinen tulevaisuus näyttää synkä sano sanoa muistaa porvaristo moni muu hyväksyä ihannoida kapina laillinen yhteis#kunta midä rikos nuijasota talonpoiki kapina laillinen hallitus ihistoriankirjoittaja kansa muutama aatelismieh lukuunottamatta tuntea myötä#tunto kapinallinen kohtaan ei silloinen laillinen hallitus kohtaan yksimielisesti imyönntää venäjä sotaväki kansa tehdä kapina laillinen esivaltaa onmistua kukistaa juhlia suomi porvaristo tapaus punainen mauha napinlävä venäjä vallankumous esiintyä isänmaa vapaus melastaja nikolai i n laillinen valta laittomasti kukistaa isänmaa itsenäinen valtio valtiopeto ei kulua oikeistosanomalehdissä uhata kapina mannerheima kolmannella tuleminen kysymys porvaristo etu mukainen kapina vaikkapa maannetos pitää maa korkeasti oppia oikeisto huoli sellainen kapina kuvata rikos arvosteltava kolmann tuleminen kysymys porvaristo etu mukainen kapina vaikkapa maannetos pitää maa korkeasti oppia oikeisto huoli sellainen kapina kuvata rikos arvosteltava kapina onnettomuus sattua olla ala#luokka kapina porvaristo etu vastainen kapina vaikkapa maannetos pitää maa korkeasti oppia oikeisto huoli sellainen kapina kuvata rikos arvosteltava kapina onnettomuus sattua olla ala#luokka kapina porvaristo etu vastainen kapina saavuttaa porvaristo taho vähintä ymmärtämä arva sanottu johdosta mahdollisesti maa korkeasti oppia oikeisto huoli sellainen kapina kuvata rikos arvosteltava kapina onnettomuus sattua olla ala#luokka kapina porvaristo etu vastainen kapina saavuttaa porvaristo taho vähintä ymmärtämä arva sanottu johdosta mahdollisesti syyttää kapina hyväksyminen sellainen kapina kuvata rikos arvosteltava kapina onnettomuus sattua olla ala#luokka kapina porvaristo etu vastainen kapina saavuttaa porvaristo taho vähintä ymmärtämä arva sanottu johdosta mahdollisesti syyttää kapina hyväksyminen e ymmärtää joku tapahtuma historiallinen enemmistö alistua vähemmistö tahto yritys hetkellinen aseellinen voittoo päättye voida viedä maa taloudellinen kehitys eteenpäin taaksemäin demokratia vallankumous välttämätön demokraattinen muoto voida saavuttaa saavuttaa tuskallinen keino sosialismi toivoton är jetön yritys punakaartilla oikea patenttikeino amnestia käyttää n s kapina lausutaanl sana ammesti alkaa porvaristo kuulua huuto kapina puhkeamaisilla virsi veisata lakivaliokuntakki kesäinen mietinnö puhua viimeaikaisinen yhteis#kunnallinen järjestys uhkaavinen ilmiö olla lakivalio#kunta mietintö liittyä porvarillisi vastalausei kummitella kapina pelko minkälainen uhata ilmiö enimmäkseen kärmäsi tehdä härkänen keväällinen viipuri kapina tulla tieto e viipuri lainalainen järjestys kukistumaisilla sotaväki kertoa sähkösanoma miitei kapinallinen puoli pitää kokous pelastusarmeija hallitusa voimaton","kansakunta haavo lääkitseminen presidentti lincol ohjelmapuhea kauniisti lausua samantamaisesti lempeästi viisaasti palauttaa englanti boerikaina rauhallinen olo etelä-afrika ed von bor olla kapina suomi porvaristo noudattaa yhdysvaltain englanti esimerkki armahduskysymys maa e sisäpoliittinen tulevaisuus näyttää synkä sano sanoa muistaa porvaristo moni muu hyväksyä ihannoida kapina laillinen yhteiskunta midä rikos nuijasota talonpoiki kapina laillinen hallitus ihistoriankirjoittaja kansa muutama aatelismieh lukuunottamatta tuntea myötätunto kapinallinen kohtaan ei silloinen laillinen hallitus kohtaan yksimielisesti imyönntää venäjä sotaväki kansa tehdä kapina laillinen esivaltaa onmistua kukistaa juhlia suomi porvaristo tapaus punainen mauha napinlävä venäjä vallankumous esiintyä isänmaa vapaus melastaja nikolai i n laillinen valta laittomasti kukistaa isänmaa itsenäinen valtio valtiopeto ei kulua oikeistosanomalehdissä uhata kapina mannerheima kolmannella tuleminen kysymys porvaristo etu mukainen kapina vaikkapa maannetos pitää maa korkeasti oppia oikeisto huoli sellainen kapina kuvata rikos arvosteltava kolmann tuleminen kysymys porvaristo etu mukainen kapina vaikkapa maannetos pitää maa korkeasti oppia oikeisto huoli sellainen kapina kuvata rikos arvosteltava kapina onnettomuus sattua olla alaluokka kapina porvaristo etu vastainen kapina vaikkapa maannetos pitää maa korkeasti oppia oikeisto huoli sellainen kapina kuvata rikos arvosteltava kapina onnettomuus sattua olla alaluokka kapina porvaristo etu vastainen kapina saavuttaa porvaristo taho vähintä ymmärtämä arva sanottu johdosta mahdollisesti maa korkeasti oppia oikeisto huoli sellainen kapina kuvata rikos arvosteltava kapina onnettomuus sattua olla alaluokka kapina porvaristo etu vastainen kapina saavuttaa porvaristo taho vähintä ymmärtämä arva sanottu johdosta mahdollisesti syyttää kapina hyväksyminen sellainen kapina kuvata rikos arvosteltava kapina onnettomuus sattua olla alaluokka kapina porvaristo etu vastainen kapina saavuttaa porvaristo taho vähintä ymmärtämä arva sanottu johdosta mahdollisesti syyttää kapina hyväksyminen e ymmärtää joku tapahtuma historiallinen enemmistö alistua vähemmistö tahto yritys hetkellinen aseellinen voittoo päättye voida viedä maa taloudellinen kehitys eteenpäin taaksemäin demokratia vallankumous välttämätön demokraattinen muoto voida saavuttaa saavuttaa tuskallinen keino sosialismi toivoton är jetön yritys punakaartilla oikea patenttikeino amnestia käyttää n s kapina lausutaanl sana ammesti alkaa porvaristo kuulua huuto kapina puhkeamaisilla virsi veisata lakivaliokuntakki kesäinen mietinnö puhua viimeaikaisinen yhteiskunnallinen järjestys uhkaavinen ilmiö olla lakivaliokunta mietintö liittyä porvarillisi vastalausei kummitella kapina pelko minkälainen uhata ilmiö enimmäkseen kärmäsi tehdä härkänen keväällinen viipuri kapina tulla tieto e viipuri lainalainen järjestys kukistumaisilla sotaväki kertoa sähkösanoma miitei kapinallinen puoli pitää kokous pelastusarmeija hallitusa voimaton","Center",0,0,1,1,0
"Suomen Sosialidemokraattinen Puolue","http://ldf.fi/semparl/speeches/s1937_1_029_025","Kivisalo, Väinö",1882,1953,"Male","46-55","1920-1960","Short","sisällissota, kapina","fispanja sota väärä puoli kysymys sopimunen suomi velvollinen tehdä espanja sisällis#sota voida rajoittaa yksinomaan espanja käsitdä estää laajentua yleinen maailmanpalo sota saada loppua ihmisyys kannalta toivottava tällaisena musta sana solvata suomi kansalainen nousta kapina laillinen hallitus herra julistaa espanja pieni vähemmistö kapina laillinen hallitus wvieläpä muukalaisilla miehi ase jalointa isänmaallisuus tällainen ajatuksenjuoksu johtaa teko arvostella millainen kommunisti edustaja tahtoa sanoa espanja hallitus s espanja cordeta edustaja espanja hallitus franco kapina heinäkuu aikoa ainoa kommunisti sosialisti näinolla puhe espanja kapinaillinen nousta taistelu kommunismi silkka pöty","fispanja sota väärä puoli kysymys sopimunen suomi velvollinen tehdä espanja sisällissota voida rajoittaa yksinomaan espanja käsitdä estää laajentua yleinen maailmanpalo sota saada loppua ihmisyys kannalta toivottava tällaisena musta sana solvata suomi kansalainen nousta kapina laillinen hallitus herra julistaa espanja pieni vähemmistö kapina laillinen hallitus wvieläpä muukalaisilla miehi ase jalointa isänmaallisuus tällainen ajatuksenjuoksu johtaa teko arvostella millainen kommunisti edustaja tahtoa sanoa espanja hallitus s espanja cordeta edustaja espanja hallitus franco kapina heinäkuu aikoa ainoa kommunisti sosialisti näinolla puhe espanja kapinaillinen nousta taistelu kommunismi silkka pöty","Center",0,0,1,0,0
"Suomen Sosialidemokraattinen Puolue","http://ldf.fi/semparl/speeches/s2019_1_080_031","Kiljunen, Kimmo",1951,NA,"Male","66+","2001-Present","Short","sisällissota","ahvenanmaalaisinen äänestää ruotsi liittyminen koka ruotsi kieli ruotsalaisuus silloinen ahvenanmaalainen identifikaatio kohde yhteiselo turbulenti suoma suomi käynti sisällissota kokea hankala suomi hallitus tietenkin tiukka ahvenanma osa suomi alue suomalainen suvereniteetti liioitellusti muotoilla","ahvenanmaalaisinen äänestää ruotsi liittyminen koka ruotsi kieli ruotsalaisuus silloinen ahvenanmaalainen identifikaatio kohde yhteiselo turbulenti suoma suomi käynti sisällissota kokea hankala suomi hallitus tietenkin tiukka ahvenanma osa suomi alue suomalainen suvereniteetti liioitellusti muotoilla","Center",0,0,1,0,0
"Suomen Sosialidemokraattinen Puolue","http://ldf.fi/semparl/speeches/s1919_1_014_050","Voionmaa, Väinö",1869,1947,"Male","46-55","Civil_War","Very Long","kapina, vallankumous","esittää sellainen mieli#pide se tehdä puolueeton vankienhoitaja niin#ikään esittää erottamattoma noin s valkoinen terrori punainen kapina keskenään vallita loogillinen yhteys syy seuraus voida toisista eroittaa myöntää surettava keskenään käsittää suuri yhteiskunnallinen kysymys sellainen persoonallinen käräjänkäynni moni tahtoa kääntää puhua kapina syy nsko kapina yksilö ilkeys ilkimys aikaansaama muu syy yksityinen ilkiö yllyttäa kapina maaperä varmaan suomi työväellä kukaan asianajaja edus#kunta mieli suomi työväi maa tappio puolelta tuomita kapina tihutyödä ihminen ei kansalainen emmekä puolue jäseni hyväksyä toivottava toiselta puoli tuomita selvästi järjestelmä kansalaisonnettomuus käydä ed a h virkkuni ihmetellä voida tyytymätön yhteiskunta surullinen punainen kapina sattua voida tyytymätön olivatko sisäiset olkoa ihanteellinen ed furuhjelm mieli sattuvasti huomauttaa eräs suuri sisällinen syy kapina nimittäin ihminen joutua valkoinen terrori alainen hindulaisi arvattavasti katsoa hindulainen kapina kukistaja englantilainen verrattavi tulla ilmaisse kapina rotuanen pyytää huomauttaa seikka hindulais jälkeläinen päivä yrittää luoda englanti ii niskoilta luultavasti maailma poistaa mieli #luulo vakaumus kapina onnettomuus kaikkein syvä sisällinen syy rotuoloissataa suuri kokonaisuus suomi onneton kapina osa vallankumouknen maailman#sota tapahtua tapahtua maailma ed a furuhjelm kauhistua sana vallankumous vaatia sosiali#demokraatti voida suuri kokonaisuus suomi onneton kapina osa vallankumouknen maailman#sota tapahtua tapahtua maailma ed a furuhjelm kauhistua sana vallankumous vaatia sosiali#demokraatti voida päästä yhteiskunta saada kansalaisoikeus valtiollinen elämisoikeus maa ikuinen aika luopua kaikki vallankumouknen historia todistaa aika luopua kaikki vallankumouknen historia todistaa turmiollinen vallankumous laatu ei tahtoa sanoa vallankumous vallankumous ikävä osa eurooppalainen vallankumous suinkaan kumo totuus vallankumous historia tapahtua","esittää sellainen mielipide se tehdä puolueeton vankienhoitaja niinikään esittää erottamattoma noin s valkoinen terrori punainen kapina keskenään vallita loogillinen yhteys syy seuraus voida toisista eroittaa myöntää surettava keskenään käsittää suuri yhteiskunnallinen kysymys sellainen persoonallinen käräjänkäynni moni tahtoa kääntää puhua kapina syy nsko kapina yksilö ilkeys ilkimys aikaansaama muu syy yksityinen ilkiö yllyttäa kapina maaperä varmaan suomi työväellä kukaan asianajaja eduskunta mieli suomi työväi maa tappio puolelta tuomita kapina tihutyödä ihminen ei kansalainen emmekä puolue jäseni hyväksyä toivottava toiselta puoli tuomita selvästi järjestelmä kansalaisonnettomuus käydä ed a h virkkuni ihmetellä voida tyytymätön yhteiskunta surullinen punainen kapina sattua voida tyytymätön olivatko sisäiset olkoa ihanteellinen ed furuhjelm mieli sattuvasti huomauttaa eräs suuri sisällinen syy kapina nimittäin ihminen joutua valkoinen terrori alainen hindulaisi arvattavasti katsoa hindulainen kapina kukistaja englantilainen verrattavi tulla ilmaisse kapina rotuanen pyytää huomauttaa seikka hindulais jälkeläinen päivä yrittää luoda englanti ii niskoilta luultavasti maailma poistaa mieli luulo vakaumus kapina onnettomuus kaikkein syvä sisällinen syy rotuoloissataa suuri kokonaisuus suomi onneton kapina osa vallankumouknen maailmansota tapahtua tapahtua maailma ed a furuhjelm kauhistua sana vallankumous vaatia sosialidemokraatti voida suuri kokonaisuus suomi onneton kapina osa vallankumouknen maailmansota tapahtua tapahtua maailma ed a furuhjelm kauhistua sana vallankumous vaatia sosialidemokraatti voida päästä yhteiskunta saada kansalaisoikeus valtiollinen elämisoikeus maa ikuinen aika luopua kaikki vallankumouknen historia todistaa aika luopua kaikki vallankumouknen historia todistaa turmiollinen vallankumous laatu ei tahtoa sanoa vallankumous vallankumous ikävä osa eurooppalainen vallankumous suinkaan kumo totuus vallankumous historia tapahtua","Center",0,0,1,1,0
"Suomen Sosialidemokraattinen Puolue","http://ldf.fi/semparl/speeches/s1919_1_023_006","Ryömä, Hannes",1878,1939,"Male","36-45","Civil_War","Very Long","vallankumous","ehdottomasti osa voimassaoleva vastata maa valtiollinen asema muuten kehitys vaatimus vastata edus#kunta venäjä vallankumous muodostaa pyrkimys mahdollinen poliittinen tilanne tarmokkaisti työskennellä kysymys ratkaiseminen sanottako nimittäin kesä toimia vajalukuinen eduskunnankki toiminta hyvä antaa","ehdottomasti osa voimassaoleva vastata maa valtiollinen asema muuten kehitys vaatimus vastata eduskunta venäjä vallankumous muodostaa pyrkimys mahdollinen poliittinen tilanne tarmokkaisti työskennellä kysymys ratkaiseminen sanottako nimittäin kesä toimia vajalukuinen eduskunnankki toiminta hyvä antaa","Center",1,0,1,0,0
"Suomen Sosialidemokraattinen Puolue","http://ldf.fi/semparl/speeches/s1917_3_038_077","Valpas, Edvard",1873,1937,"Male","36-45","Civil_War","Short","vallankumous","vallan#kumous tehdä suomi työväenliikkeenen epäileä muutos tilaisuus ottaa selvä ilmiö liikke työväenliike nykyään paa toimi kaikenlainen pikkuteko toteuttaa sosialidemokraattinen yhteis#kunta ryhmä näyttää sellainen arvella tulli panna toimi jonkinlainen sosialinen vallankumous suoma ryhmä vielä kuolla niinkuin ed alkio olettaa elää mahdollisesti toimimaa suuri eurooppa maa sod vaarallinen seuraus kannattaa kiistellä itsenäisyys suomi hankkia saksa ensiksi tuottaa venäjä tappio tekijä venäjä vallankumous kukistaa keisari tekijä vallankumous kukistaa ruhtinas ljvoffi miljukoffin valta tekijä w kukistaa kerenskin itsenäisyys suomi hankkia saksa ensiksi tuottaa venäjä tappio tekijä venäjä vallankumous kukistaa keisari tekijä vallankumous kukistaa ruhtinas ljvoffi miljukoffin valta tekijä w kukistaa kerens hallitus vastustaa suomi itsenäisyys vihdoin saada","vallankumous tehdä suomi työväenliikkeenen epäileä muutos tilaisuus ottaa selvä ilmiö liikke työväenliike nykyään paa toimi kaikenlainen pikkuteko toteuttaa sosialidemokraattinen yhteiskunta ryhmä näyttää sellainen arvella tulli panna toimi jonkinlainen sosialinen vallankumous suoma ryhmä vielä kuolla niinkuin ed alkio olettaa elää mahdollisesti toimimaa suuri eurooppa maa sod vaarallinen seuraus kannattaa kiistellä itsenäisyys suomi hankkia saksa ensiksi tuottaa venäjä tappio tekijä venäjä vallankumous kukistaa keisari tekijä vallankumous kukistaa ruhtinas ljvoffi miljukoffin valta tekijä w kukistaa kerenskin itsenäisyys suomi hankkia saksa ensiksi tuottaa venäjä tappio tekijä venäjä vallankumous kukistaa keisari tekijä vallankumous kukistaa ruhtinas ljvoffi miljukoffin valta tekijä w kukistaa kerens hallitus vastustaa suomi itsenäisyys vihdoin saada","Center",1,0,1,0,0
"Suomen Sosialidemokraattinen Puolue","http://ldf.fi/semparl/speeches/s1921_1_076_034","Keto, Jaakko",1884,1947,"Male","36-45","1920-1960","Very Long","vallankumous","pitää erillään seikka nimittäin neuvostohallitus väittää halu tuhota suomi itsenäi syys jäsen toivomus suoma niinkuin muualla maailma puhjeta vproletaarinen vallankumous täällä pystyttää neuvostojärjestelmä jos viimeksi#mainita toive epäilemätön luulla suomi itsenäisyys sitteni taata neuvostohallitus olla venäjä peräsimessä joku taantumuksellinen","pitää erillään seikka nimittäin neuvostohallitus väittää halu tuhota suomi itsenäi syys jäsen toivomus suoma niinkuin muualla maailma puhjeta vproletaarinen vallankumous täällä pystyttää neuvostojärjestelmä jos viimeksimainita toive epäilemätön luulla suomi itsenäisyys sitteni taata neuvostohallitus olla venäjä peräsimessä joku taantumuksellinen","Center",1,0,1,0,0
"Suomen Sosialidemokraattinen Puolue","http://ldf.fi/semparl/speeches/s1945_1_037_017","Paasivuori, Arvo",1905,1987,"Male","36-45","1920-1960","Long","luokkasota","venäjä työväenluokka yhteinen sortaja tsaarihallitus taistelu johtaa vuosi voitto tunnustaa venäjä valta päästä työväen#luokka muodostaa hallitus suomi itsenäisyys suomi syntyä luokkasota työväestö hävitä ainoastaan saksan häviö silloinen maailman#sota pelastaa suomi työväen#luokka orjuus edelläkuvata asiaintila pysyvä ulko sisäpoliittinen seuraus maa — taantumuksellinen porvaristo","venäjä työväenluokka yhteinen sortaja tsaarihallitus taistelu johtaa vuosi voitto tunnustaa venäjä valta päästä työväenluokka muodostaa hallitus suomi itsenäisyys suomi syntyä luokkasota työväestö hävitä ainoastaan saksan häviö silloinen maailmansota pelastaa suomi työväenluokka orjuus edelläkuvata asiaintila pysyvä ulko sisäpoliittinen seuraus maa — taantumuksellinen porvaristo","Center",0,0,1,0,0
"Suomen Sosialidemokraattinen Puolue","http://ldf.fi/semparl/speeches/s1928_1_057_002","Huttunen, Edvard",1889,1943,"Male","36-45","1920-1960","Very Long","kansalaissota","rikollinen oleteta työväki suomi ryhtyä kunnioittaa juhlapäivä esinä tammikuu päivä n s kansalais#sota alkaa sota#päivä muisto juhlita tula vetää valta#kunta lippu esinä helsing kaupunki rahatoimikamari kaupungintalo katto valtio#neuvosto katto silloin","rikollinen oleteta työväki suomi ryhtyä kunnioittaa juhlapäivä esinä tammikuu päivä n s kansalaissota alkaa sotapäivä muisto juhlita tula vetää valtakunta lippu esinä helsing kaupunki rahatoimikamari kaupungintalo katto valtioneuvosto katto silloin","Center",0,0,1,0,0
"Suomen Sosialidemokraattinen Puolue","http://ldf.fi/semparl/speeches/s1929_2_039_017","Hakkila, Väinö",1882,1958,"Male","46-55","1920-1960","Very Short","vallankumous","mennä vuosikymmen taaksepäin löytää ajan#kohta punainen väri punainen lippu yleinen muoti suoma sen ki venäjä vallankumous vapauttaa maa kansallislipu tilaisuus hulmuta kattoj harjoa suomi leijonalipa sentään punainen jokin väri oikeisto porvaristo","mennä vuosikymmen taaksepäin löytää ajankohta punainen väri punainen lippu yleinen muoti suoma sen ki venäjä vallankumous vapauttaa maa kansallislipu tilaisuus hulmuta kattoj harjoa suomi leijonalipa sentään punainen jokin väri oikeisto porvaristo","Center",1,0,1,0,0
"Suomen Sosialidemokraattinen Puolue","http://ldf.fi/semparl/speeches/s1935_2_105_043","Kivisalo, Väinö",1882,1953,"Male","46-55","1920-1960","Long","kansalaissota","valo suomi itsenäisyys yksinomaisesti riippua valkoinen voito kansalaissoda rehellinen totuus suomi itsenäisyys saavuttaa pari kuukausi kansalais#sota alkoika tietää venäjä vallanpitäji rehellinen aikomus täyttää toimen#pide valtiollinen ero johtua täyttivä brest-litovs rauhan#sopimus tehdä ennenkuin alkoika tietää venäjä vallanpitäji rehellinen aikomus täyttää toimen#pide valtiollinen ero johtua täyttivä brest-litovs rauhan#sopimus tehdä ennenkuin kansalaissota päättyikä vastoin oikeistoporvari esilläolla aloite silloinen aie menestyä suomi olla itsenäinen tasa#valta keisarillinen saksa alaisuus ratkaista erimielisyyksä rauhallinen keino noloa työväi muu nolo kamppailu jatkaa katkeruus kansalaissota jäie terrori synnyttää käydä rakkaus hyvä tahto mieli haihduttaa pysyvä onni varmaan molemmat os teko suomi kansa kunnioittaa nuija#mies onni maa valkoinen punaistenkki aie onnistua kansalais#sota päättyä sovintorauha hyvä työläinen porvarienkki keskuudessa toivoa onni suuri sovintorauha saada tehdä","valo suomi itsenäisyys yksinomaisesti riippua valkoinen voito kansalaissoda rehellinen totuus suomi itsenäisyys saavuttaa pari kuukausi kansalaissota alkoika tietää venäjä vallanpitäji rehellinen aikomus täyttää toimenpide valtiollinen ero johtua täyttivä brest-litovs rauhansopimus tehdä ennenkuin alkoika tietää venäjä vallanpitäji rehellinen aikomus täyttää toimenpide valtiollinen ero johtua täyttivä brest-litovs rauhansopimus tehdä ennenkuin kansalaissota päättyikä vastoin oikeistoporvari esilläolla aloite silloinen aie menestyä suomi olla itsenäinen tasavalta keisarillinen saksa alaisuus ratkaista erimielisyyksä rauhallinen keino noloa työväi muu nolo kamppailu jatkaa katkeruus kansalaissota jäie terrori synnyttää käydä rakkaus hyvä tahto mieli haihduttaa pysyvä onni varmaan molemmat os teko suomi kansa kunnioittaa nuijamies onni maa valkoinen punaistenkki aie onnistua kansalaissota päättyä sovintorauha hyvä työläinen porvarienkki keskuudessa toivoa onni suuri sovintorauha saada tehdä","Center",0,0,1,0,0
"Suomen Sosialidemokraattinen Puolue","http://ldf.fi/semparl/speeches/s1935_2_088_039","Räisänen, Yrjö",1888,1948,"Male","46-55","1920-1960","Very Long","kapina, vallankumous","riittää vuosi surullinen murheellinen kansalais#sota vuosi puhe tuaho iikolli taho pitää olla muistaa kapina tulla perusteellisesti rangaisttu rankaiseminen jäädä vähä iikolli lapualais mäntsälä kapina rankaiseminen vuosi syyttäjäin muistaa ed kares vallankumous epävarma yritys onnistua lu syvä aihe vallankumous niinkuin itsestään rupea vallankumous tehdä tekopeli mi homma paukuttaa pää sosialidemokraatei käydä n ta va niinkuin itsestään rupea vallankumous tehdä tekopeli mi homma paukuttaa pää sosialidemokraatei käydä n ta va tapahtua vallankumous käydä täydellisesti punainen lippu merkki muistaa nykyinen kokoomuslainen punainen sanoa tältä paikka vakuutella","riittää vuosi surullinen murheellinen kansalaissota vuosi puhe tuaho iikolli taho pitää olla muistaa kapina tulla perusteellisesti rangaisttu rankaiseminen jäädä vähä iikolli lapualais mäntsälä kapina rankaiseminen vuosi syyttäjäin muistaa ed kares vallankumous epävarma yritys onnistua lu syvä aihe vallankumous niinkuin itsestään rupea vallankumous tehdä tekopeli mi homma paukuttaa pää sosialidemokraatei käydä n ta va niinkuin itsestään rupea vallankumous tehdä tekopeli mi homma paukuttaa pää sosialidemokraatei käydä n ta va tapahtua vallankumous käydä täydellisesti punainen lippu merkki muistaa nykyinen kokoomuslainen punainen sanoa tältä paikka vakuutella","Center",0,0,1,0,0
"Suomen Sosialidemokraattinen Puolue","http://ldf.fi/semparl/speeches/s1926_1_061_093","Aalto, Johan",1886,1946,"Male","36-45","1920-1960","Very Short","kapina","yleiskeskustelu päivä kosketella joku puute lakiehdotus $ ssä mikään määritellä laki kapina katsoa ryhtyä toistaa tapaus päivä mainita osoittaa tavallinen lakkotaist#etu vähimmässä määrä valtiollinen luonne semmoinen selvennys kukaan epälys laki tulla käyttää väärin senvuo ehdottaa i $ n momenta lisättäisi seuraava lause kapina laki olla joukko henkilö ase#voima ryhtyä kumota voimassaoleva oikeusjärjestys iisäys suinkaan heikentää mikään lak","yleiskeskustelu päivä kosketella joku puute lakiehdotus $ ssä mikään määritellä laki kapina katsoa ryhtyä toistaa tapaus päivä mainita osoittaa tavallinen lakkotaistetu vähimmässä määrä valtiollinen luonne semmoinen selvennys kukaan epälys laki tulla käyttää väärin senvuo ehdottaa i $ n momenta lisättäisi seuraava lause kapina laki olla joukko henkilö asevoima ryhtyä kumota voimassaoleva oikeusjärjestys iisäys suinkaan heikentää mikään lak","Center",0,1,1,0,0
"Suomen Sosialidemokraattinen Puolue","http://ldf.fi/semparl/speeches/s1929_2_043_037","Myllymäki, Kalle",1883,1933,"Male","46-55","1920-1960","Short","kansalaissota","suomi itsenäisyyt käsittely paikka edus#kunta sanoa suomi kansalais#sota päättyä mikään kohota punainen lippu maailma politiikka kohota punainen lippu tehdä mahdollinen suomenkki selviytyä tukala tilanne mihinkä","suomi itsenäisyyt käsittely paikka eduskunta sanoa suomi kansalaissota päättyä mikään kohota punainen lippu maailma politiikka kohota punainen lippu tehdä mahdollinen suomenkki selviytyä tukala tilanne mihinkä","Center",0,0,1,0,0
